,title,price,image
0,"Canon EOS 3000D DSLR Camera 1 Camera Body, 18 - 55 mm Lens","₹26,899",https://rukminim1.flixcart.com/image/312/312/jfbfde80/camera/n/r/n/canon-eos-eos-3000d-dslr-original-imaf3t5h9yuyc5zu.jpeg?q=70
1,Canon EOS M50 Mark II Mirrorless Camera EF-M15-45mm is STM Lens,"₹54,890",https://rukminim1.flixcart.com/image/312/312/knyxqq80/dslr-camera/r/y/x/digital-camera-eos-m50-mark-ii-eos-m50-mark-ii-canon-original-imag2gzkexzqhyhu.jpeg?q=70
2,Canon EOS 200D II DSLR Camera EF-S18-55mm IS STM,"₹54,390",https://rukminim1.flixcart.com/image/312/312/juwzf680/dslr-camera/g/a/q/200d-ii-200d-ii-canon-original-imaffvrhzyqzayys.jpeg?q=70
3,Canon EOS 1500D DSLR Camera Body+ 18-55 mm IS II Lens,"₹36,390",https://rukminim1.flixcart.com/image/312/312/kk01pjk0/dslr-camera/f/v/o/eos-1500d-canon-original-imafzfugydh2mjgf.jpeg?q=70
4,Canon EOS R10 Mirrorless Camera Body with RF-S 18 - 150 mm f/3.5 - 6.3 IS STM Lens Kit,"₹1,11,899",https://rukminim1.flixcart.com/image/312/312/l5fnhjk0/dslr-camera/f/t/m/eos-r10-24-2-r10-canon-original-imagg42fsbgv79da.jpeg?q=70
5,SONY Alpha Full Frame ILCE-7M2K/BQ IN5 Mirrorless Camera Body with 28 - 70 mm Lens,"₹76,899",https://rukminim1.flixcart.com/image/312/312/l5jxt3k0/dslr-camera/m/n/a/-original-imagg7hsggshhwbz.jpeg?q=70
6,Canon EOS 90D DSLR Camera Body with Single Lens 18 - 135 mm IS USM,"₹1,11,990",https://rukminim1.flixcart.com/image/312/312/k1jlyfk0/dslr-camera/b/c/a/90d-eos-90d-canon-original-imafh3b6jvmzyesh.jpeg?q=70
7,FUJIFILM X Series X-E4 Mirrorless Camera Body with XF 27 mm F2.8 R WR Prime Lens,"₹89,899",https://rukminim1.flixcart.com/image/312/312/kmds4nk0/dslr-camera/l/r/f/x-e4-x-e4-fujifilm-original-imagfazttxmjtpdx.jpeg?q=70
8,GoPro HERO8 Black Sports and Action Camera,"₹29,899",https://rukminim1.flixcart.com/image/312/312/k547l3k0/sports-action-camera/z/9/a/hero8-black-with-3-way-grip-and-battery-na-chdhx-801-rw-gopro-original-imafhw4zpbrtemru.jpeg?q=70
9,SONY ILCE-7M4/BQ IN5 Mirrorless Camera Body Only,"₹2,11,790",https://rukminim1.flixcart.com/image/312/312/l08gsy80/dslr-camera/s/e/b/-original-imagc2cz2hyqgwmn.jpeg?q=70
10,SJCAM SJ6 Legend SJ6 Legend Sports and Action Camera,"₹9,399",https://rukminim1.flixcart.com/image/312/312/kl6wx3k0/sports-action-camera/h/i/k/sjcam-sj6-legend-sj6-legend-sj6-legend-sjcam-original-imagydf2xefhbfjw.jpeg?q=70
11,GoPro Hero9 Sports and Action Camera,"₹34,890",https://rukminim1.flixcart.com/image/312/312/kf75fgw0/sports-action-camera/n/x/f/hero-9-hero-chdhx-901-gopro-original-imafvzw4qhgprxhh.jpeg?q=70
12,1CAMPRO GOPRO ACTION CAMERA GoPro Action Camera 4k16MP Wifi 30M Waterproof Action Camera Sports DV Cam...,"₹2,099",https://rukminim1.flixcart.com/image/312/312/xif0q/sports-action-camera/0/e/q/gopro-action-camera-4k16mp-wifi-30m-waterproof-action-camera-original-imaghfrbqjhww4yz.jpeg?q=70
13,FUJIFILM Instax Treasure Box Mini 11 Instant Camera,"₹5,699",https://rukminim1.flixcart.com/image/312/312/kp2y2kw0/instant-camera/3/z/r/treasure-box-mini-11-instax-mini-11-fujifilm-original-imag3efzmkzvretx.jpeg?q=70
14,DMG 4K Wifi Waterproof Helmet 2 inch LCD Display Ultra-HD 12MP 170Â° Wide Angle Lens Full HD Sports an...,"₹1,662",https://rukminim1.flixcart.com/image/312/312/jl41nrk0/sports-action-camera/n/a/g/waterproof-helmet-2-inch-lcd-display-ultra-hd-12mp-170-wide-original-imaf8b9jucxgtyrb.jpeg?q=70
15,FUJIFILM X Series X-T4 Mirrorless Camera Body with XF 18-55mm Lens,"₹1,56,900",https://rukminim1.flixcart.com/image/312/312/ken59jk0/dslr-camera/e/p/5/x-t4-mirrorless-camera-body-with-xf-18-55mm-lens-x-t4-fujifilm-original-imafv9xzzwhrdr6h.jpeg?q=70
16,SONY ILCE-7CL/SQ IN5 Mirrorless Camera Mirrorless,"₹1,63,190",https://rukminim1.flixcart.com/image/312/312/kw9krrk0/dslr-camera/s/k/y/-original-imag8z5wgnmpqfvy.jpeg?q=70
17,SJCAM SJ 4000 Air 4K Full HD WiFi 30M Waterproof Sports Action Camera Waterproof DV Camcorder 16MP Spo...,"₹4,399",https://rukminim1.flixcart.com/image/312/312/koudfgw0/sports-action-camera/k/l/3/4000-air-4k-full-hd-wifi-30m-waterproof-sports-action-camera-original-imag37azyptu4zak.jpeg?q=70
18,FUJIFILM X Series X-S10 Mirrorless Camera Body with XF 16 - 80 mm Lens,"₹1,39,399",https://rukminim1.flixcart.com/image/312/312/khuvxjk0/dslr-camera/n/8/r/x-s10-x-s10-fujifilm-original-imafxsdjbgey4dqh.jpeg?q=70
19,Fitspark Eagle i6 Pro Sports and Action Camera,"₹5,199",https://rukminim1.flixcart.com/image/312/312/ktx9si80/sports-action-camera/c/q/p/eagle-i6-pro-eagle-2-16-eagle-i6-pro-fitspark-original-imag75x3qsgdqern.jpeg?q=70
20,Insta360 One X2 Sports and Action Camera,"₹35,899",https://rukminim1.flixcart.com/image/312/312/kll7bm80/sports-action-camera/w/y/2/one-x2-one-cinosxx-a-insta360-original-imagyzbbyhcw8hh5.jpeg?q=70
21,SIOVS WIFI SECURITY CAMERA HD Spy IP Camera Hidden Wireless CCTV Security with Microphone Security Cam...,"₹1,134",https://rukminim1.flixcart.com/image/312/312/kwnv6a80/home-security-camera/d/a/j/1-ccdy85-indoor-outdoor-security-camera-ctrzq-original-imag9afzpnmp2vzy.jpeg?q=70
22,NIKON Z 50 Mirrorless Camera Body with 16-50mm Lens,"₹75,399",https://rukminim1.flixcart.com/image/312/312/k5o7r0w0/dslr-camera/z/h/4/z-50-z-50-nikon-original-imafzasjz33kaa8k.jpeg?q=70
23,GoPro Hero11 Waterproof Sports and Action Camera,"₹51,400",https://rukminim1.flixcart.com/image/312/312/xif0q/sports-action-camera/k/c/j/waterproof-hero11-2-27-23-chdhx-111-rw-gopro-original-imagg5bnxd5r3ac7.jpeg?q=70
